Sheet: Данные
A1: Дата - Время | B1: ВЛ С-6 P Интеграл
A2: 25.06.18 - 03:00:00
A3: 25.06.18 - 03:30:00 | B3: 2.63
A4: 25.06.18 - 04:00:00 | B4: 3.96 | C4: =SUM(R[-1]C[-1]:RC[-1]) -> 6.59
A5: 25.06.18 - 04:30:00 | B5: 3.76
A6: 25.06.18 - 05:00:00 | B6: 8.56 | C6: =SUM(R[-1]C[-1]:RC[-1]) -> 12.32
A7: 25.06.18 - 05:30:00 | B7: 7.14
A8: 25.06.18 - 06:00:00 | B8: 8.69 | C8: =SUM(R[-1]C[-1]:RC[-1]) -> 15.829999999999998
A9: 25.06.18 - 06:30:00 | B9: 8.9700000000000006
A10: 25.06.18 - 07:00:00 | B10: 9.4600000000000009 | C10: =SUM(R[-1]C[-1]:RC[-1]) -> 18.43
A11: 25.06.18 - 07:30:00 | B11: 4.95
A12: 25.06.18 - 08:00:00 | B12: 6.45 | C12: =SUM(R[-1]C[-1]:RC[-1]) -> 11.4
A13: 25.06.18 - 08:30:00 | B13: 6.06
A14: 25.06.18 - 09:00:00 | B14: 9.0500000000000007 | C14: =SUM(R[-1]C[-1]:RC[-1]) -> 15.11
A15: 25.06.18 - 09:30:00 | B15: 12.85
A16: 25.06.18 - 10:00:00 | B16: 9.1300000000000008 | C16: =SUM(R[-1]C[-1]:RC[-1]) -> 21.98
A17: 25.06.18 - 10:30:00 | B17: 5.64
A18: 25.06.18 - 11:00:00 | B18: 7.83 | C18: =SUM(R[-1]C[-1]:RC[-1]) -> 13.469999999999999
A19: 25.06.18 - 11:30:00 | B19: 9.59
A20: 25.06.18 - 12:00:00 | B20: 9.98 | C20: =SUM(R[-1]C[-1]:RC[-1]) -> 19.57
A21: 25.06.18 - 12:30:00 | B21: 14.67
A22: 25.06.18 - 13:00:00 | B22: 13.62 | C22: =SUM(R[-1]C[-1]:RC[-1]) -> 28.29